{"contract_version":"1.0.0","definitions":[{"consumer_modules":["model.projector","workflow.agent"],"event_class":"model_surface","event_type":"agent.message","event_version":1,"payload_schema_digest":"sha256:1111111111111111111111111111111111111111111111111111111111111111","persistence":"durable","producer_module":"agent.phase","projection_rule":"message"},{"consumer_modules":["audit.reader"],"event_class":"log_only","event_type":"audit.record","event_version":1,"payload_schema_digest":"sha256:2222222222222222222222222222222222222222222222222222222222222222","persistence":"durable","producer_module":"audit.writer","projection_rule":"none"},{"consumer_modules":["workflow.agent"],"event_class":"live_coordination","event_type":"workflow.signal","event_version":1,"payload_schema_digest":"sha256:3333333333333333333333333333333333333333333333333333333333333333","persistence":"ephemeral","producer_module":"workflow.engine","projection_rule":"none"}],"schema_version":"coh.model-surface-event-vocabulary/v1","vocabulary_digest":"sha256:fd1399f580f383b73df20b7496e7d677aaf37beb3febb8cdca2ee2ce14f3d4bf","vocabulary_revision":1}
